{
  "schema_version": "m0.2",
  "task_id": "TASK-03",
  "title": "实现 provider 配置校验（合成实验）",
  "goal_ref": "G-DEMO",
  "stage_ref": "S-DEMO",
  "requirement_refs": [
    "R-001"
  ],
  "allowed_change_paths": [
    "config_loader.py"
  ],
  "protected_paths": [
    "tests_reference/**",
    "tests_wrong_contract/**",
    "project_config.py"
  ],
  "acceptance_review": {
    "status": "APPROVED",
    "basis": "合成基准审批，不代表真实用户或可信生产审批。",
    "approval_ref": "fixture-review-03",
    "approved_payload_sha256": "89ec942b44b97c0f305c4e8c904bb4a2b8676ecf64999b3d5ede357f533abb2d"
  },
  "properties": [
    {
      "id": "P-001",
      "statement": "缺少 provider 时抛出 MissingProviderError，不得默认填充。",
      "origin": "EXPLICIT",
      "requirement_refs": [
        "R-001"
      ],
      "scope_impact": "LOCAL_REFINEMENT",
      "scope_expansion_authorized": false,
      "checks": [
        {
          "method": "UNIT_TEST",
          "required": true,
          "reference": "tests_reference/test_provider_requirement.py::test_missing_provider_raises"
        },
        {
          "method": "UNIT_TEST",
          "required": true,
          "reference": "tests_reference/test_provider_requirement.py::test_present_provider_unchanged"
        }
      ]
    }
  ],
  "task_checks": [
    {
      "method": "DIFF_ALLOWLIST",
      "required": true,
      "reference": "allowed_change_paths"
    }
  ],
  "acceptance_test_manifest": [
    {
      "path": "tests_reference/test_provider_requirement.py",
      "sha256_utf8_lf": "0f8f9393cae9b9f9cc70a535509d5d085d157060c3793f80737d80ee6b94d302"
    }
  ]
}
